{
  "authority_scope": "fixture-reproducible-build-structure-only",
  "claim_usable": false,
  "fixture": true,
  "non_claims_acknowledged": [
    "not production cryptography",
    "not runtime containment",
    "not host cleanliness proof",
    "not FIPS validated",
    "not government validated",
    "not externally certified",
    "not whole-system post-quantum safe",
    "not an independent audit",
    "not a perfect Daylight score claim from repository-owned evidence"
  ],
  "receipts": [
    {
      "artifact_sha256": "bdaefb595dfc1f7ce15a297abafb240ae36a5134e9b7e184eef58f5e6cfd67d3",
      "artifact_sha3_512": "083183439a2082d81736b59cd3e081e6d83fbde71849a7650f814bd43922f523d0704c95351cafc6e87d7d78e9720f0248f53ee8b005ce4620b62a98c34ef446",
      "artifact_size": 84,
      "build_instructions_digest": "8888888888888888888888888888888888888888888888888888888888888888",
      "builder_family": "linux-python-3.12-a",
      "builder_id": "independent-builder-a",
      "byte_identical_output": true,
      "environment_digest": "1212121212121212121212121212121212121212121212121212121212121212",
      "receipt_digest": "5a9b0cc90ee83148752a1495aa658e7d0dc74ff3ad24967379de31b840ad69eb",
      "receipt_id": "rebuild-a",
      "source_commit": "1111111111111111111111111111111111111111"
    },
    {
      "artifact_sha256": "bdaefb595dfc1f7ce15a297abafb240ae36a5134e9b7e184eef58f5e6cfd67d3",
      "artifact_sha3_512": "083183439a2082d81736b59cd3e081e6d83fbde71849a7650f814bd43922f523d0704c95351cafc6e87d7d78e9720f0248f53ee8b005ce4620b62a98c34ef446",
      "artifact_size": 84,
      "build_instructions_digest": "8888888888888888888888888888888888888888888888888888888888888888",
      "builder_family": "linux-python-3.12-b",
      "builder_id": "independent-builder-b",
      "byte_identical_output": true,
      "environment_digest": "3434343434343434343434343434343434343434343434343434343434343434",
      "receipt_digest": "98389fa86dc1cab313f2d293e5b1e1bf37805c2e33559db90e6a5b6093700295",
      "receipt_id": "rebuild-b",
      "source_commit": "1111111111111111111111111111111111111111"
    }
  ],
  "schema_id": "daylight-v20-reproducible-build-bundle",
  "schema_version": "0.1.0"
}
